{
  "$schema": "https://json-schema.org/draft/2020-12/schema",
  "$id": "https://secid.cloudsecurityalliance.org/schemas/registry-namespace.schema.json",
  "title": "SecID Registry Namespace",
  "description": "Validates SecID registry namespace JSON files. Each file describes one namespace (organization) within a single SecID type, including identity, resolution URLs, and pattern trees for matching subpath identifiers.",
  "type": "object",
  "required": ["schema_version", "namespace", "type", "status", "official_name"],
  "properties": {
    "schema_version": {
      "type": "string",
      "description": "JSON schema version for this file.",
      "const": "1.0"
    },
    "namespace": {
      "type": "string",
      "description": "Organization identifier — domain name, optionally with /path segments (e.g., 'mitre.org', 'github.com/advisories').",
      "minLength": 1
    },
    "type": {
      "type": "string",
      "description": "SecID type this namespace belongs to.",
      "enum": ["advisory", "weakness", "ttp", "control", "capability", "methodology", "disclosure", "regulation", "entity", "reference"]
    },
    "status": {
      "type": "string",
      "description": "Registry entry status reflecting documentation completeness and review state.",
      "enum": ["proposed", "draft", "pending", "published"]
    },
    "status_notes": {
      "description": "Optional context about status (blockers, gaps, guidance for contributors).",
      "oneOf": [
        { "type": "string" },
        { "type": "null" }
      ]
    },
    "official_name": {
      "type": "string",
      "description": "Official/legal name of the organization.",
      "minLength": 1
    },
    "common_name": {
      "description": "Common short name (e.g., 'MITRE', 'NIST').",
      "oneOf": [
        { "type": "string" },
        { "type": "null" }
      ]
    },
    "alternate_names": {
      "description": "Other names for search/matching.",
      "oneOf": [
        {
          "type": "array",
          "items": { "type": "string" }
        },
        { "type": "null" }
      ]
    },
    "notes": {
      "description": "Free-form context for AI and human readers. Markdown allowed.",
      "oneOf": [
        { "type": "string" },
        { "type": "null" }
      ]
    },
    "alias_of": {
      "description": "If present, this is an alias stub — namespace redirects to the target value. No sources needed.",
      "oneOf": [
        { "type": "string" },
        { "type": "null" }
      ]
    },
    "wikidata": {
      "description": "Wikidata Q-numbers for entity disambiguation.",
      "oneOf": [
        {
          "type": "array",
          "items": { "type": "string" }
        },
        { "type": "null" }
      ]
    },
    "wikipedia": {
      "description": "Wikipedia article URLs for direct access.",
      "oneOf": [
        {
          "type": "array",
          "items": { "type": "string", "format": "uri" }
        },
        { "type": "null" }
      ]
    },
    "checked": {
      "type": "string",
      "description": "Date someone last verified the entry is still accurate (YYYY-MM-DD).",
      "pattern": "^\\d{4}-\\d{2}-\\d{2}$"
    },
    "updated": {
      "type": "string",
      "description": "Date the entry last materially changed (YYYY-MM-DD).",
      "pattern": "^\\d{4}-\\d{2}-\\d{2}$"
    },
    "urls": {
      "description": "Top-level URLs for the organization (website, docs, API, etc.).",
      "type": "array",
      "items": { "$ref": "#/$defs/UrlObject" }
    },
    "match_nodes": {
      "description": "Pattern tree for matching SecID name/subpath components. Each node matches a portion of the SecID string and optionally has children for deeper matching.",
      "type": "array",
      "items": { "$ref": "#/$defs/MatchNode" }
    },
    "tags": {
      "description": "Optional filterable metadata (country, sector, etc.) for this namespace as a whole. Same shape as a match_node's data.tags (see MatchNode). Resolution is per-level, not merged: a query for the namespace gets these tags; a query for a specific source/subpath gets that node's own data.tags if present, otherwise falls back to these. Keys are open/uncontrolled for now — see docs/reference/REGISTRY-JSON-FORMAT.md.",
      "$ref": "#/$defs/Tags"
    }
  },
  "additionalProperties": true,
  "$defs": {
    "UrlObject": {
      "type": "object",
      "description": "A URL with type classification and optional metadata.",
      "required": ["url", "type"],
      "properties": {
        "url": {
          "type": "string",
          "description": "The URL. May contain {placeholder} templates."
        },
        "type": {
          "type": "string",
          "description": "URL category: website, docs, api, bulk_data, lookup, security, security_txt, paper, github, search, secid_api, secid_mcp, etc."
        },
        "note": {
          "type": "string",
          "description": "Human/AI-readable context explaining what this URL is for."
        },
        "lang": {
          "type": "string",
          "description": "ISO 639-1 language code (e.g., 'en', 'fr', 'de')."
        },
        "format": {
          "type": "string",
          "description": "Expected content format: html, json, pdf, xml, csv, zip."
        },
        "checked": {
          "type": "string",
          "description": "Date this URL was last verified (YYYY-MM-DD).",
          "pattern": "^\\d{4}-\\d{2}-\\d{2}$"
        },
        "updated": {
          "type": "string",
          "description": "Date this URL entry last changed (YYYY-MM-DD).",
          "pattern": "^\\d{4}-\\d{2}-\\d{2}$"
        }
      },
      "additionalProperties": true
    },
    "MatchNode": {
      "type": "object",
      "description": "A pattern tree node. Matches a portion of the SecID string (name, version, subpath, or item_version) via regex patterns. Returns data when matched and optionally recurses into children for the next portion.",
      "required": ["patterns"],
      "properties": {
        "patterns": {
          "type": "array",
          "description": "One or more regex patterns (OR alternatives). All share the same children and data. Use (?i) prefix for case-insensitive matching.",
          "items": { "type": "string" },
          "minItems": 1
        },
        "description": {
          "type": "string",
          "description": "Human/AI-readable description of what this node matches."
        },
        "weight": {
          "type": "integer",
          "description": "Match quality/preference. 0-200, higher is more preferred. Returned with results so consumers can sort.",
          "minimum": 0,
          "maximum": 200
        },
        "data": {
          "type": "object",
          "description": "Result data returned when this node matches. Contents vary by tree depth and SecID type — name-level nodes have source metadata, subpath-level nodes have resolution URLs. Open-ended: different types use different fields.",
          "additionalProperties": true
        },
        "children": {
          "type": "array",
          "description": "Child nodes for matching the next portion of the SecID string. Recursive structure.",
          "items": { "$ref": "#/$defs/MatchNode" }
        },
        "open_pattern": {
          "type": "boolean",
          "description": "Declares that this node's identifier space is genuinely unbounded (GitHub usernames, Jira project keys, conference paper slugs) and the permissive pattern is intentional and reviewed. Resolvers exclude such nodes from unscoped cross-source search — an unbounded pattern cannot discriminate between a real identifier and an arbitrary search term — while namespace-scoped resolution still works. Absence means the pattern is expected to be discriminating; scripts/check-pattern-breadth.py fails an undeclared open pattern. Prefer data.known_values where the values can be enumerated."
        }
      },
      "additionalProperties": false
    },
    "Tags": {
      "type": "object",
      "description": "Filterable metadata: a dict of key -> array of string values (always an array, even for a single value). Keys are open/uncontrolled for now (e.g. 'country' with ISO 3166-1 alpha-2 codes plus 'EU'/'INTL', 'sector'). Not validated beyond shape — see docs/reference/REGISTRY-JSON-FORMAT.md for the current starter conventions. Can appear at the namespace's top-level 'tags' field or inside any match_node's 'data.tags' field (the latter is not schema-enforced since MatchNode.data is open-ended, but should follow this same shape).",
      "additionalProperties": {
        "type": "array",
        "items": { "type": "string" }
      }
    },
    "VersionAlias": {
      "type": "object",
      "description": "An alternate label for the version entry this object is nested under. Publishers routinely label one release two ways: CSA stamps the AICM workbook 1.1.0 while branding the same release 'v1.1' on its download page, and does the reverse for CCM where 4.1 is canonical and 4.1.0 is the variant. Nesting encodes the target, so there is no pointer to dangle. IMPORTANT: this object is metadata only. Matching is done by the pattern tree — the alias label must also appear as an OR-pattern on the corresponding version node, or it will never resolve. scripts/validate-version-aliases.py enforces that binding.",
      "required": ["label", "on_match"],
      "properties": {
        "label": {
          "type": "string",
          "minLength": 1,
          "description": "The alias exactly as the publisher writes it. Never normalized — no case folding, no 'v' stripping, no semver inference. Must not equal a real version string in the same source."
        },
        "on_match": {
          "type": "string",
          "enum": ["resolve", "redirect"],
          "description": "What a resolver does when this label matches. 'resolve' returns full data inline with status 'found' and version_matched_alias set — for co-equal publisher labels. 'redirect' returns empty results with status 'corrected' and the canonical SecID in the message — for labels that should be retired. Reserved and deliberately unimplemented: 'track' (a moving pointer to the latest matching version). Resolvers must ignore alias entries whose on_match they do not recognize, so reserved values can ship later without breaking deployed resolvers."
        },
        "note": {
          "type": "string",
          "description": "Where this label appears, or why it exists."
        }
      },
      "additionalProperties": false
    },
    "VersionEntry": {
      "type": "object",
      "description": "One known version of a source, in a match_node's data.versions_available array. Each entry must correspond to a version-level node in that source's pattern tree whose patterns[0] is the canonical version string; the validator enforces this both ways. Not schema-enforced here, because versions_available lives inside match_nodes[].data and data is additionalProperties:true — see scripts/validate-version-aliases.py.",
      "required": ["version"],
      "properties": {
        "version": {
          "type": "string",
          "minLength": 1,
          "description": "The canonical version string, exactly as the artifact identifies itself. Where a publisher's download page and the artifact disagree, the artifact wins and the page's label becomes an alias."
        },
        "release_date": {
          "oneOf": [{ "type": "string" }, { "type": "null" }],
          "description": "ISO date, or null if researched and unknown."
        },
        "status": {
          "type": "string",
          "description": "Lifecycle state, e.g. 'current', 'superseded', 'draft'."
        },
        "note": {
          "type": "string",
          "description": "What a consumer needs to know about this specific version — item counts, mapping changes, ID-stability warnings, sourcing caveats."
        },
        "aliases": {
          "type": "array",
          "description": "Alternate labels for this version. Each must also appear as an OR-pattern on the corresponding version node in the tree.",
          "items": { "$ref": "#/$defs/VersionAlias" }
        }
      },
      "additionalProperties": true
    }
  }
}
