{
  "schema_version": "1.0",
  "namespace": "pqcc.org",
  "type": "entity",
  "status": "draft",
  "status_notes": null,
  "official_name": "Post-Quantum Cryptography Coalition",
  "common_name": "PQCC",
  "alternate_names": null,
  "notes": "Industry coalition working on post-quantum cryptography migration. Publishes the PQC Migration Roadmap, threat assessments, and members-only working drafts. Hosted by MITRE.",
  "wikidata": null,
  "wikipedia": null,
  "urls": [
    {
      "type": "website",
      "url": "https://pqcc.org"
    }
  ],
  "match_nodes": []
}
