{
  "schema_version": "1.0",
  "namespace": "softiron.com",
  "type": "disclosure",
  "status": "draft",
  "status_notes": "Generated from CVE CNA partner data (cve.org), 2026-04-03.",
  "official_name": "SoftIron",
  "common_name": null,
  "alternate_names": null,
  "notes": "CVE Program partner. Country: USA.",
  "wikidata": null,
  "wikipedia": null,
  "urls": [
    {
      "type": "website",
      "url": "https://softiron.com"
    }
  ],
  "match_nodes": [
    {
      "patterns": [
        "(?i)^cna$"
      ],
      "description": "CNA",
      "weight": 80,
      "data": {
        "organization_type": "Vendor",
        "contacts": [
          {
            "type": "email",
            "value": "cve-coordination@softiron.com",
            "note": "Email"
          }
        ],
        "urls": [
          {
            "type": "docs",
            "url": "https://softiron.com/legal/security-disclosure/",
            "note": "Disclosure policy"
          },
          {
            "type": "website",
            "url": "https://advisories.softiron.cloud/",
            "note": "Security advisories"
          },
          {
            "type": "website",
            "url": "https://www.cve.org/PartnerInformation/ListofPartners/partner/SoftIron",
            "note": "CVE partner page"
          }
        ],
        "examples": [],
        "cve": {
          "role": [
            "cna"
          ],
          "assignerShortName": "SoftIron",
          "assignerOrgId": "0a72a055-908d-47f5-a16a-1f09049c16c6",
          "cna_partner_url": "https://www.cve.org/PartnerInformation/ListofPartners/partner/SoftIron",
          "last_assigned_cve": "CVE-2026-1842",
          "last_assigned_date": "2026-02-20",
          "scope": "SoftIron HyperCloud branded products and technologies only.",
          "cna_id": "CNA-2023-0058"
        },
        "security_txt": null,
        "disclosure_policy": {
          "url": "https://softiron.com/legal/security-disclosure/",
          "checked": "2026-04-08"
        }
      }
    }
  ]
}
