{
  "schema_version": "1.0",
  "namespace": "octopus.com",
  "type": "entity",
  "status": "draft",
  "status_notes": "Auto-generated stub from CVE CNA disclosure data. Identity metadata copied from the matching disclosure entry; match_nodes are empty pending human review to add product/service patterns. See companion secid:disclosure/octopus.com/cna for the vulnerability-reporting program.",
  "official_name": "Octopus Deploy",
  "common_name": null,
  "alternate_names": null,
  "notes": "Organization with a CVE Numbering Authority (CNA) disclosure program. See secid:disclosure/octopus.com/cna for vulnerability-reporting channels and contacts. This entity entry was auto-generated to ensure each CNA-vendor has a parallel identity record; the match_nodes array is empty pending human research into the vendor's specific products and services.",
  "wikidata": null,
  "wikipedia": null,
  "urls": [
    {
      "type": "website",
      "url": "https://octopus.com"
    }
  ],
  "match_nodes": []
}
