{
  "schema_version": "1.0",
  "namespace": "euroclear.com",
  "type": "entity",
  "status": "draft",
  "status_notes": null,
  "official_name": "Euroclear Group",
  "common_name": "Euroclear",
  "alternate_names": null,
  "notes": "Major European central securities depository (CSD) and settlement operator. Holds and settles bonds, equities, and ETFs. Publishes participant operational/security requirements; restricted.",
  "wikidata": null,
  "wikipedia": null,
  "urls": [
    {
      "type": "website",
      "url": "https://www.euroclear.com"
    }
  ],
  "match_nodes": []
}
