{
  "schema_version": "1.0",
  "namespace": "dremio.com",
  "type": "disclosure",
  "status": "draft",
  "status_notes": "Generated from CVE CNA partner data (cve.org), 2026-04-03.",
  "official_name": "Dremio Corporation",
  "common_name": null,
  "alternate_names": null,
  "notes": "CVE Program partner. Country: USA.",
  "wikidata": null,
  "wikipedia": null,
  "urls": [
    {
      "type": "website",
      "url": "https://dremio.com"
    }
  ],
  "match_nodes": [
    {
      "patterns": [
        "(?i)^cna$"
      ],
      "description": "CNA",
      "weight": 80,
      "data": {
        "organization_type": "Vendor, Open Source",
        "contacts": [
          {
            "type": "email",
            "value": "security@dremio.com",
            "note": "Email"
          }
        ],
        "urls": [
          {
            "type": "docs",
            "url": "https://www.dremio.com/platform/security/responsible-disclosure-limitations/",
            "note": "Disclosure policy"
          },
          {
            "type": "website",
            "url": "https://docs.dremio.com/current/reference/bulletins/",
            "note": "Security advisories"
          },
          {
            "type": "website",
            "url": "https://www.cve.org/PartnerInformation/ListofPartners/partner/Dremio",
            "note": "CVE partner page"
          }
        ],
        "examples": [],
        "cve": {
          "role": [
            "cna"
          ],
          "assignerShortName": "Dremio",
          "assignerOrgId": "05b98450-cf83-4905-9546-e47a66a8fec2",
          "cna_partner_url": "https://www.cve.org/PartnerInformation/ListofPartners/partner/Dremio",
          "last_assigned_cve": "CVE-2025-2298",
          "last_assigned_date": "2025-04-21",
          "scope": "All Dremio Corporation products.",
          "cna_id": "CNA-2024-0024"
        },
        "security_txt": null,
        "disclosure_policy": {
          "url": "https://www.dremio.com/platform/security/responsible-disclosure-limitations/",
          "checked": "2026-04-08"
        }
      }
    }
  ]
}
