{
  "schema_version": "1.0",
  "namespace": "appian.com",
  "type": "entity",
  "status": "draft",
  "status_notes": "Auto-generated stub from the CSA public member list (csa-website-members-2026-06-08). Identity is the member's name and primary domain; match_nodes are empty pending human review to add product/service patterns. CSA membership itself is a relationship-layer fact and is intentionally not encoded on this record.",
  "official_name": "Appian",
  "common_name": null,
  "alternate_names": null,
  "notes": "Organization sourced from the Cloud Security Alliance public member roster. This entity entry was auto-generated to give each member a parallel identity record; the match_nodes array is empty pending human research into the organization's specific products and services.",
  "wikidata": null,
  "wikipedia": null,
  "urls": [
    {
      "type": "website",
      "url": "https://appian.com"
    }
  ],
  "match_nodes": []
}
