{
  "schema_version": "1.0",
  "namespace": "silver-peak.com",
  "type": "disclosure",
  "status": "draft",
  "status_notes": "Generated from CVE CNA partner data (cve.org), 2026-04-03.",
  "official_name": "Silver Peak Systems, Inc.",
  "common_name": null,
  "alternate_names": null,
  "notes": "CVE Program partner. Country: USA.",
  "wikidata": null,
  "wikipedia": null,
  "urls": [
    {
      "type": "website",
      "url": "https://silver-peak.com"
    }
  ],
  "match_nodes": [
    {
      "patterns": [
        "(?i)^cna$"
      ],
      "description": "CNA",
      "weight": 80,
      "data": {
        "organization_type": "Vendor",
        "contacts": [
          {
            "type": "email",
            "value": "sirt@silver-peak.com",
            "note": "Email",
            "_broken": true,
            "_broken_verified": "2026-05-09",
            "_broken_failure": "rejected_email",
            "_broken_note": "Gmail bounce: 550 5.4.1 Recipient address rejected. Silver Peak was acquired by HPE/Aruba; alias retired.",
            "_broken_source": "CVEProject/cve-website#3938"
          }
        ],
        "urls": [
          {
            "type": "docs",
            "url": "https://www.silver-peak.com/support/user-documentation/security-advisories",
            "note": "Disclosure policy"
          },
          {
            "type": "website",
            "url": "https://www.silver-peak.com/support/user-documentation/security-advisories",
            "note": "Security advisories"
          },
          {
            "type": "website",
            "url": "https://www.cve.org/PartnerInformation/ListofPartners/partner/Silver_Peak",
            "note": "CVE partner page"
          }
        ],
        "examples": [],
        "cve": {
          "role": [
            "cna"
          ],
          "assignerShortName": "Silver_Peak",
          "cna_partner_url": "https://www.cve.org/PartnerInformation/ListofPartners/partner/Silver_Peak",
          "scope": "Silver Peak product issues only.",
          "cna_id": "CNA-2020-0011"
        },
        "security_txt": null,
        "disclosure_policy": {
          "url": "https://www.silver-peak.com/support/user-documentation/security-advisories",
          "checked": "2026-04-08"
        }
      }
    }
  ]
}
