{
  "schema_version": "1.0",
  "namespace": "wikimedia.org",
  "type": "reference",
  "status": "draft",
  "status_notes": "Generated from glossary research sweep 2026-05-21; org metadata copied from existing same-org entries under other SecID types.",
  "official_name": "The Wikimedia Foundation",
  "common_name": null,
  "alternate_names": null,
  "notes": "CVE Program partner. Country: USA.",
  "wikidata": null,
  "wikipedia": null,
  "urls": [
    {
      "type": "website",
      "url": "https://wikimedia.org"
    }
  ],
  "match_nodes": [
    {
      "patterns": [
        "(?i)^security-team-definitions$"
      ],
      "description": "Wikimedia Security Team Definitions",
      "weight": 100,
      "data": {
        "official_name": "Wikimedia Security Team Definitions",
        "common_name": null,
        "alternate_names": null,
        "description": "Wikimedia Security Team Definitions",
        "notes": "",
        "urls": [
          {
            "type": "source",
            "url": "https://www.mediawiki.org/wiki/Wikimedia_Security_Team/Definitions"
          }
        ],
        "examples": []
      }
    }
  ]
}