{
  "schema_version": "1.0",
  "namespace": "a-isac.com",
  "type": "entity",
  "status": "draft",
  "status_notes": null,
  "official_name": "Aviation Information Sharing and Analysis Center",
  "common_name": "A-ISAC",
  "alternate_names": null,
  "notes": "Member-driven information-sharing organization for the global aviation sector — airlines, airports, manufacturers, MRO providers, ATM/ATC operators. Publishes threat intelligence and operational cybersecurity guidance. Members-only.",
  "wikidata": null,
  "wikipedia": null,
  "urls": [
    {
      "type": "website",
      "url": "https://www.a-isac.com"
    }
  ],
  "match_nodes": []
}
